[Port6]  :  Dispositivo USB composito


Is Port User Connectable:         yes
Is Port Debug Capable:            no
Companion Port Number:            18
Companion Hub Symbolic Link Name: USB#ROOT_HUB30#4&2a76328f&0&0#{f18a0e88-c30c-11d0-8815-00a0c906bed8}
Protocols Supported:
 USB 1.1:                         yes
 USB 2.0:                         yes
 USB 3.0:                         no

Device Power State:               PowerDeviceD0

       ---===>Device Information<===---
English product name: "Webcam C170"

ConnectionStatus:                  
Current Config Value:              0x01  -> Device Bus Speed: High (is not SuperSpeed or higher capable)
Device Address:                    0x33
Open Pipes:                           1

          ===>Device Descriptor<===
bLength:                           0x12
bDescriptorType:                   0x01
bcdUSB:                          0x0200
bDeviceClass:                      0xEF  -> This is a Multi-interface Function Code Device
bDeviceSubClass:                   0x02  -> This is the Common Class Sub Class
bDeviceProtocol:                   0x01  -> This is the Interface Association Descriptor protocol
bMaxPacketSize0:                   0x40 = (64) Bytes
idVendor:                        0x046D = Logitech Inc.
idProduct:                       0x082B
bcdDevice:                       0x28C5
iManufacturer:                     0x01
     English (United States)  " "
iProduct:                          0x02
     English (United States)  "Webcam C170"
iSerialNumber:                     0x00
bNumConfigurations:                0x01

          ---===>Open Pipes<===---

          ===>Endpoint Descriptor<===
bLength:                           0x07
bDescriptorType:                   0x05
bEndpointAddress:                  0x81  -> Direction: IN - EndpointID: 1
bmAttributes:                      0x03  -> Interrupt Transfer Type
wMaxPacketSize:                  0x0010 = 1 transactions per microframe, 0x10 max bytes
bInterval:                         0x07

       ---===>Full Configuration Descriptor<===---

          ===>Configuration Descriptor<===
bLength:                           0x09
bDescriptorType:                   0x02
wTotalLength:                    0x046C  -> Validated
bNumInterfaces:                    0x04
bConfigurationValue:               0x01
iConfiguration:                    0x00
bmAttributes:                      0x80  -> Bus Powered
MaxPower:                          0xFA = 500 mA

          ===>IAD Descriptor<===
bLength:                           0x08
bDescriptorType:                   0x0B
bFirstInterface:                   0x00
bInterfaceCount:                   0x02
bFunctionClass:                    0x0E  -> Video Interface Class
bFunctionSubClass:                 0x03  -> Video Interface Collection
bFunctionProtocol:                 0x00  -> PC_PROTOCOL_UNDEFINED protocol
iFunction:                         0x04
     English (United States)  "Webcam C170"

          ===>Interface Descriptor<===
bLength:                           0x09
bDescriptorType:                   0x04
bInterfaceNumber:                  0x00
bAlternateSetting:                 0x00
bNumEndpoints:                     0x01
bInterfaceClass:                   0x0E  -> Video Interface Class
bInterfaceSubClass:                0x01  -> Video Control Interface SubClass
bInterfaceProtocol:                0x00
iInterface:                        0x04
     English (United States)  "Webcam C170"

          ===>Class-Specific Video Control Interface Header Descriptor<===
bLength:                           0x0D
bDescriptorType:                   0x24
bDescriptorSubtype:                0x01
bcdVDC:                          0x0100
wTotalLength:                    0x004F  -> Validated
dwClockFreq:                 0x01C9C380 = (30000000) Hz
bInCollection:                     0x01
baInterfaceNr[1]:                  0x01
USB Video Class device: spec version 1.0

          ===>Video Control Extension Unit Descriptor<===
bLength:                           0x1C
bDescriptorType:                   0x24
bDescriptorSubtype:                0x06
bUnitID:                           0x06
guidExtensionCode:                 {68BBD0B0-61A4-4B83-90B7-A6215F3C4F70}
bNumControls:                      0x18
bNrInPins:                         0x01
===>List of Connected Units and Terminal ID's
baSourceID[1]:                     0x02
bControlSize:                      0x03
bmControls : 0xFF 0xFF 0xFF 
     D00 = 1  yes -  Vendor-Specific (Optional)
     D01 = 1  yes -  Vendor-Specific (Optional)
     D02 = 1  yes -  Vendor-Specific (Optional)
     D03 = 1  yes -  Vendor-Specific (Optional)
     D04 = 1  yes -  Vendor-Specific (Optional)
     D05 = 1  yes -  Vendor-Specific (Optional)
     D06 = 1  yes -  Vendor-Specific (Optional)
     D07 = 1  yes -  Vendor-Specific (Optional)
     D08 = 1  yes -  Vendor-Specific (Optional)
     D09 = 1  yes -  Vendor-Specific (Optional)
     D10 = 1  yes -  Vendor-Specific (Optional)
     D11 = 1  yes -  Vendor-Specific (Optional)
     D12 = 1  yes -  Vendor-Specific (Optional)
     D13 = 1  yes -  Vendor-Specific (Optional)
     D14 = 1  yes -  Vendor-Specific (Optional)
     D15 = 1  yes -  Vendor-Specific (Optional)
     D16 = 1  yes -  Vendor-Specific (Optional)
     D17 = 1  yes -  Vendor-Specific (Optional)
     D18 = 1  yes -  Vendor-Specific (Optional)
     D19 = 1  yes -  Vendor-Specific (Optional)
     D20 = 1  yes -  Vendor-Specific (Optional)
     D21 = 1  yes -  Vendor-Specific (Optional)
     D22 = 1  yes -  Vendor-Specific (Optional)
     D23 = 1  yes -  Vendor-Specific (Optional)
iExtension:                        0x00

          ===>Video Control Input Terminal Descriptor<===
bLength:                           0x12
bDescriptorType:                   0x24
bDescriptorSubtype:                0x02
bTerminalID:                       0x01
wTerminalType:                   0x0201 = (ITT_CAMERA)
bAssocTerminal:                    0x00
iTerminal:                         0x00
===>Camera Input Terminal Data
wObjectiveFocalLengthMin:        0x0000
wObjectiveFocalLengthMax:        0x0000
wOcularFocalLength:              0x0000
bControlSize:                      0x03
bmControls : 0x0E 0x0A 0x00 
     D00 = 0   no -  Scanning Mode
     D01 = 1  yes -  Auto-Exposure Mode
     D02 = 1  yes -  Auto-Exposure Priority
     D03 = 1  yes -  Exposure Time (Absolute)
     D04 = 0   no -  Exposure Time (Relative)
     D05 = 0   no -  Focus (Absolute)
     D06 = 0   no -  Focus (Relative)
     D07 = 0   no -  Iris (Absolute)
     D08 = 0   no -  Iris (Relative)
     D09 = 1  yes -  Zoom (Absolute)
     D10 = 0   no -  Zoom (Relative)
     D11 = 1  yes -  PanTilt (Absolute)
     D12 = 0   no -  PanTilt (Relative)
     D13 = 0   no -  Roll (Absolute)
     D14 = 0   no -  Roll (Relative)
     D15 = 0   no -  Reserved
     D16 = 0   no -  Reserved
     D17 = 0   no -  Focus, Auto
     D18 = 0   no -  Privacy
     D19 = 0   no -  Focus, Simple
     D20 = 0   no -  Window
     D21 = 0   no -  Region of Interest
     D22 = 0   no -  Reserved
     D23 = 0   no -  Reserved

          ===>Video Control Processing Unit Descriptor<===
bLength:                           0x0B
bDescriptorType:                   0x24
bDescriptorSubtype:                0x05
bUnitID:                           0x02
bSourceID:                         0x01
wMaxMultiplier:                  0x0000
bControlSize:                      0x02
bmControls : 0x7F 0x15 
     D00 = 1  yes -  Brightness
     D01 = 1  yes -  Contrast
     D02 = 1  yes -  Hue
     D03 = 1  yes -  Saturation
     D04 = 1  yes -  Sharpness
     D05 = 1  yes -  Gamma
     D06 = 1  yes -  White Balance Temperature
     D07 = 0   no -  White Balance Component
     D08 = 1  yes -  Backlight Compensation
     D09 = 0   no -  Gain
     D10 = 1  yes -  Power Line Frequency
     D11 = 0   no -  Hue, Auto
     D12 = 1  yes -  White Balance Temperature, Auto
     D13 = 0   no -  White Balance Component, Auto
     D14 = 0   no -  Digital Multiplier
     D15 = 0   no -  Digital Multiplier Limit
iProcessing :                      0x00

          ===>Video Control Output Terminal Descriptor<===
bLength:                           0x09
bDescriptorType:                   0x24
bDescriptorSubtype:                0x03
bTerminalID:                       0x03
wTerminalType:                   0x0101 = (TT_STREAMING)
bAssocTerminal:                    0x00
bSourceID:                         0x02
iTerminal:                         0x00

          ===>Endpoint Descriptor<===
bLength:                           0x07
bDescriptorType:                   0x05
bEndpointAddress:                  0x81  -> Direction: IN - EndpointID: 1
bmAttributes:                      0x03  -> Interrupt Transfer Type
wMaxPacketSize:                  0x0010 = 1 transactions per microframe, 0x10 max bytes
bInterval:                         0x07

          ===>Class-specific VC Interrupt Endpoint Descriptor<===
bLength:                           0x05 
bDescriptorType:                   0x25
bDescriptorSubtype:                0x03
wMaxTransferSize:                0x0010 = (16) Bytes

          ===>Interface Descriptor<===
bLength:                           0x09
bDescriptorType:                   0x04
bInterfaceNumber:                  0x01
bAlternateSetting:                 0x00
bNumEndpoints:                     0x00
bInterfaceClass:                   0x0E  -> Video Interface Class
bInterfaceSubClass:                0x02  -> Video Streaming Interface SubClass
bInterfaceProtocol:                0x00
iInterface:                        0x04
     English (United States)  "Webcam C170"

          ===>Video Class-Specific VS Video Input Header Descriptor<===
bLength:                           0x0F
bDescriptorType:                   0x24
bDescriptorSubtype:                0x01
bNumFormats:                       0x02
wTotalLength:                    0x02E9  -> Validated
bEndpointAddress:                  0x82  -> Direction: IN - EndpointID: 2
bmInfo:                            0x00  -> Dynamic Format Change not Supported
bTerminalLink:                     0x03
bStillCaptureMethod:               0x01  -> Still Capture Method 1
bTriggerSupport:                   0x01  -> Hardware Triggering Support
bTriggerUsage:                     0x00  -> Host will initiate still image capture
bControlSize:                      0x01
Video Payload Format 1             0x00 
     D00 = 0   no -  Key Frame Rate
     D01 = 0   no -  P Frame Rate
     D02 = 0   no -  Compression Quality
     D03 = 0   no -  Compression Window Size
     D04 = 0   no -  Generate Key Frame
     D05 = 0   no -  Update Frame Segment
     D06 = 0   no -  Reserved
     D07 = 0   no -  Reserved
Video Payload Format 2             0x00 
     D00 = 0   no -  Key Frame Rate
     D01 = 0   no -  P Frame Rate
     D02 = 0   no -  Compression Quality
     D03 = 0   no -  Compression Window Size
     D04 = 0   no -  Generate Key Frame
     D05 = 0   no -  Update Frame Segment
     D06 = 0   no -  Reserved
     D07 = 0   no -  Reserved

          ===>Video Streaming Uncompressed Format Type Descriptor<===
bLength:                           0x1B
bDescriptorType:                   0x24
bDescriptorSubtype:                0x04
bFormatIndex:                      0x01
bNumFrameDescriptors:              0x09
guidFormat:                        {32595559-0000-0010-8000-00AA00389B71} = YUY2 Format
bBitsPerPixel:                     0x10
bDefaultFrameIndex:                0x01
bAspectRatioX:                     0x00
bAspectRatioY:                     0x00
bmInterlaceFlags:                  0x00
     D0    = 0x00 Interlaced stream or variable: No
     D1    = 0x00 Fields per frame: 2 fields
     D2    = 0x00 Field 1 first: No
     D3    = 0x00 Reserved
     D4..5 = 0x00 Field patterns  -> Field 1 only
     D6..7 = 0x00 Display Mode  -> Bob only
bCopyProtect:                      0x00  -> Duplication Unrestricted

          ===>Video Streaming Uncompressed Frame Type Descriptor<===
          --->This is the Default (optimum) Frame index
bLength:                           0x22
bDescriptorType:                   0x24
bDescriptorSubtype:                0x05
bFrameIndex:                       0x01
bmCapabilities:                    0x01
wWidth:                          0x0280 = 640
wHeight:                         0x01E0 = 480
dwMinBitRate:                0x04650000
dwMaxBitRate:                0x08CA0000
dwMaxVideoFrameBufferSize:   0x00096000
dwDefaultFrameInterval:      0x00051615 = 33.333300 mSec (30.00 Hz)
bFrameIntervalType:                0x02
===>Additional Discrete Frame Type Data
dwFrameInterval[1]:          0x00051615 = 33.333300 mSec (30.00 Hz)
dwFrameInterval[2]:          0x000A2C2A = 66.666600 mSec (15.00 Hz)

          ===>Video Streaming Uncompressed Frame Type Descriptor<===
bLength:                           0x22
bDescriptorType:                   0x24
bDescriptorSubtype:                0x05
bFrameIndex:                       0x02
bmCapabilities:                    0x01
wWidth:                          0x0160 = 352
wHeight:                         0x0120 = 288
dwMinBitRate:                0x01734000
dwMaxBitRate:                0x02E68000
dwMaxVideoFrameBufferSize:   0x00031800
dwDefaultFrameInterval:      0x00051615 = 33.333300 mSec (30.00 Hz)
bFrameIntervalType:                0x02
===>Additional Discrete Frame Type Data
dwFrameInterval[1]:          0x00051615 = 33.333300 mSec (30.00 Hz)
dwFrameInterval[2]:          0x000A2C2A = 66.666600 mSec (15.00 Hz)

          ===>Video Streaming Uncompressed Frame Type Descriptor<===
bLength:                           0x22
bDescriptorType:                   0x24
bDescriptorSubtype:                0x05
bFrameIndex:                       0x03
bmCapabilities:                    0x01
wWidth:                          0x0140 = 320
wHeight:                         0x00F0 = 240
dwMinBitRate:                0x01194000
dwMaxBitRate:                0x02328000
dwMaxVideoFrameBufferSize:   0x00025800
dwDefaultFrameInterval:      0x00051615 = 33.333300 mSec (30.00 Hz)
bFrameIntervalType:                0x02
===>Additional Discrete Frame Type Data
dwFrameInterval[1]:          0x00051615 = 33.333300 mSec (30.00 Hz)
dwFrameInterval[2]:          0x000A2C2A = 66.666600 mSec (15.00 Hz)

          ===>Video Streaming Uncompressed Frame Type Descriptor<===
bLength:                           0x22
bDescriptorType:                   0x24
bDescriptorSubtype:                0x05
bFrameIndex:                       0x04
bmCapabilities:                    0x01
wWidth:                          0x00B0 = 176
wHeight:                         0x0090 = 144
dwMinBitRate:                0x005CD000
dwMaxBitRate:                0x00B9A000
dwMaxVideoFrameBufferSize:   0x0000C600
dwDefaultFrameInterval:      0x00051615 = 33.333300 mSec (30.00 Hz)
bFrameIntervalType:                0x02
===>Additional Discrete Frame Type Data
dwFrameInterval[1]:          0x00051615 = 33.333300 mSec (30.00 Hz)
dwFrameInterval[2]:          0x000A2C2A = 66.666600 mSec (15.00 Hz)

          ===>Video Streaming Uncompressed Frame Type Descriptor<===
bLength:                           0x22
bDescriptorType:                   0x24
bDescriptorSubtype:                0x05
bFrameIndex:                       0x05
bmCapabilities:                    0x01
wWidth:                          0x00A0 = 160
wHeight:                         0x0078 = 120
dwMinBitRate:                0x00465000
dwMaxBitRate:                0x008CA000
dwMaxVideoFrameBufferSize:   0x00009600
dwDefaultFrameInterval:      0x00051615 = 33.333300 mSec (30.00 Hz)
bFrameIntervalType:                0x02
===>Additional Discrete Frame Type Data
dwFrameInterval[1]:          0x00051615 = 33.333300 mSec (30.00 Hz)
dwFrameInterval[2]:          0x000A2C2A = 66.666600 mSec (15.00 Hz)

          ===>Video Streaming Uncompressed Frame Type Descriptor<===
bLength:                           0x22
bDescriptorType:                   0x24
bDescriptorSubtype:                0x05
bFrameIndex:                       0x06
bmCapabilities:                    0x01
wWidth:                          0x0220 = 544
wHeight:                         0x0120 = 288
dwMinBitRate:                0x023DC000
dwMaxBitRate:                0x047B8000
dwMaxVideoFrameBufferSize:   0x0004C800
dwDefaultFrameInterval:      0x00051615 = 33.333300 mSec (30.00 Hz)
bFrameIntervalType:                0x02
===>Additional Discrete Frame Type Data
dwFrameInterval[1]:          0x00051615 = 33.333300 mSec (30.00 Hz)
dwFrameInterval[2]:          0x000A2C2A = 66.666600 mSec (15.00 Hz)

          ===>Video Streaming Uncompressed Frame Type Descriptor<===
bLength:                           0x22
bDescriptorType:                   0x24
bDescriptorSubtype:                0x05
bFrameIndex:                       0x07
bmCapabilities:                    0x01
wWidth:                          0x01B0 = 432
wHeight:                         0x00F0 = 240
dwMinBitRate:                0x017BB000
dwMaxBitRate:                0x02F76000
dwMaxVideoFrameBufferSize:   0x00032A00
dwDefaultFrameInterval:      0x00051615 = 33.333300 mSec (30.00 Hz)
bFrameIntervalType:                0x02
===>Additional Discrete Frame Type Data
dwFrameInterval[1]:          0x00051615 = 33.333300 mSec (30.00 Hz)
dwFrameInterval[2]:          0x000A2C2A = 66.666600 mSec (15.00 Hz)

          ===>Video Streaming Uncompressed Frame Type Descriptor<===
bLength:                           0x22
bDescriptorType:                   0x24
bDescriptorSubtype:                0x05
bFrameIndex:                       0x08
bmCapabilities:                    0x01
wWidth:                          0x0140 = 320
wHeight:                         0x00B0 = 176
dwMinBitRate:                0x00CE4000
dwMaxBitRate:                0x019C8000
dwMaxVideoFrameBufferSize:   0x0001B800
dwDefaultFrameInterval:      0x00051615 = 33.333300 mSec (30.00 Hz)
bFrameIntervalType:                0x02
===>Additional Discrete Frame Type Data
dwFrameInterval[1]:          0x00051615 = 33.333300 mSec (30.00 Hz)
dwFrameInterval[2]:          0x000A2C2A = 66.666600 mSec (15.00 Hz)

          ===>Video Streaming Uncompressed Frame Type Descriptor<===
bLength:                           0x22
bDescriptorType:                   0x24
bDescriptorSubtype:                0x05
bFrameIndex:                       0x09
bmCapabilities:                    0x01
wWidth:                          0x0280 = 640
wHeight:                         0x0168 = 360
dwMinBitRate:                0x034BC000
dwMaxBitRate:                0x06978000
dwMaxVideoFrameBufferSize:   0x00070800
dwDefaultFrameInterval:      0x00051615 = 33.333300 mSec (30.00 Hz)
bFrameIntervalType:                0x02
===>Additional Discrete Frame Type Data
dwFrameInterval[1]:          0x00051615 = 33.333300 mSec (30.00 Hz)
dwFrameInterval[2]:          0x000A2C2A = 66.666600 mSec (15.00 Hz)

          ===>Color Matching Descriptor<===
bLength:                           0x06
bDescriptorType:                   0x24
bDescriptorSubtype:                0x0D
bColorPrimaries:                   0x01
bTransferCharacteristics:          0x01
bMatrixCoefficients:               0x04

          ===>Video Streaming MJPEG Format Type Descriptor<===
bLength:                           0x0B
bDescriptorType:                   0x24
bDescriptorSubtype:                0x06
bFormatIndex:                      0x02
bNumFrameDescriptors:              0x0B
bmFlags:                           0x01  -> Sample Size is Fixed
bDefaultFrameIndex:                0x01
bAspectRatioX:                     0x00
bAspectRatioY:                     0x00
bmInterlaceFlags:                  0x00
     D00   = 0  non-Interlaced stream or variable
     D01   = 0  2 fields per frame
     D02   = 0  Field 1 not first
     D03   = 0  Reserved
     D4..5 = 0  Field patterns  -> Field 1 only
     D6..7 = 0  Display Mode  -> Bob only
bCopyProtect:                      0x00  -> Duplication Unrestricted

          ===>Video Streaming MJPEG Frame Type Descriptor<===
          --->This is the Default (optimum) Frame index
bLength:                           0x22
bDescriptorType:                   0x24
bDescriptorSubtype:                0x07
bFrameIndex:                       0x01
bmCapabilities:                    0x01
wWidth:                          0x0280 = 640
wHeight:                         0x01E0 = 480
dwMinBitRate:                0x06978000
dwMaxBitRate:                0x0D2F0000
dwMaxVideoFrameBufferSize:   0x000E1000
dwDefaultFrameInterval:      0x00051615 = 33.333300 mSec (30.00 Hz)
bFrameIntervalType:                0x02
===>Additional Discrete Frame TypeData
dwFrameInterval[1]:          0x00051615 = 33.333300 mSec (30.00 Hz)
dwFrameInterval[2]:          0x000A2C2A = 66.666600 mSec (15.00 Hz)

          ===>Video Streaming MJPEG Frame Type Descriptor<===
bLength:                           0x22
bDescriptorType:                   0x24
bDescriptorSubtype:                0x07
bFrameIndex:                       0x02
bmCapabilities:                    0x01
wWidth:                          0x0160 = 352
wHeight:                         0x0120 = 288
dwMinBitRate:                0x022CE000
dwMaxBitRate:                0x0459C000
dwMaxVideoFrameBufferSize:   0x0004A400
dwDefaultFrameInterval:      0x00051615 = 33.333300 mSec (30.00 Hz)
bFrameIntervalType:                0x02
===>Additional Discrete Frame TypeData
dwFrameInterval[1]:          0x00051615 = 33.333300 mSec (30.00 Hz)
dwFrameInterval[2]:          0x000A2C2A = 66.666600 mSec (15.00 Hz)

          ===>Video Streaming MJPEG Frame Type Descriptor<===
bLength:                           0x22
bDescriptorType:                   0x24
bDescriptorSubtype:                0x07
bFrameIndex:                       0x03
bmCapabilities:                    0x01
wWidth:                          0x0140 = 320
wHeight:                         0x00F0 = 240
dwMinBitRate:                0x01A5E000
dwMaxBitRate:                0x034BC000
dwMaxVideoFrameBufferSize:   0x00038400
dwDefaultFrameInterval:      0x00051615 = 33.333300 mSec (30.00 Hz)
bFrameIntervalType:                0x02
===>Additional Discrete Frame TypeData
dwFrameInterval[1]:          0x00051615 = 33.333300 mSec (30.00 Hz)
dwFrameInterval[2]:          0x000A2C2A = 66.666600 mSec (15.00 Hz)

          ===>Video Streaming MJPEG Frame Type Descriptor<===
bLength:                           0x22
bDescriptorType:                   0x24
bDescriptorSubtype:                0x07
bFrameIndex:                       0x04
bmCapabilities:                    0x01
wWidth:                          0x00B0 = 176
wHeight:                         0x0090 = 144
dwMinBitRate:                0x008B3800
dwMaxBitRate:                0x01167000
dwMaxVideoFrameBufferSize:   0x00012900
dwDefaultFrameInterval:      0x00051615 = 33.333300 mSec (30.00 Hz)
bFrameIntervalType:                0x02
===>Additional Discrete Frame TypeData
dwFrameInterval[1]:          0x00051615 = 33.333300 mSec (30.00 Hz)
dwFrameInterval[2]:          0x000A2C2A = 66.666600 mSec (15.00 Hz)

          ===>Video Streaming MJPEG Frame Type Descriptor<===
bLength:                           0x22
bDescriptorType:                   0x24
bDescriptorSubtype:                0x07
bFrameIndex:                       0x05
bmCapabilities:                    0x01
wWidth:                          0x00A0 = 160
wHeight:                         0x0078 = 120
dwMinBitRate:                0x00697800
dwMaxBitRate:                0x00D2F000
dwMaxVideoFrameBufferSize:   0x0000E100
dwDefaultFrameInterval:      0x00051615 = 33.333300 mSec (30.00 Hz)
bFrameIntervalType:                0x02
===>Additional Discrete Frame TypeData
dwFrameInterval[1]:          0x00051615 = 33.333300 mSec (30.00 Hz)
dwFrameInterval[2]:          0x000A2C2A = 66.666600 mSec (15.00 Hz)

          ===>Video Streaming MJPEG Frame Type Descriptor<===
bLength:                           0x22
bDescriptorType:                   0x24
bDescriptorSubtype:                0x07
bFrameIndex:                       0x06
bmCapabilities:                    0x01
wWidth:                          0x0220 = 544
wHeight:                         0x0120 = 288
dwMinBitRate:                0x035CA000
dwMaxBitRate:                0x06B94000
dwMaxVideoFrameBufferSize:   0x00072C00
dwDefaultFrameInterval:      0x00051615 = 33.333300 mSec (30.00 Hz)
bFrameIntervalType:                0x02
===>Additional Discrete Frame TypeData
dwFrameInterval[1]:          0x00051615 = 33.333300 mSec (30.00 Hz)
dwFrameInterval[2]:          0x000A2C2A = 66.666600 mSec (15.00 Hz)

          ===>Video Streaming MJPEG Frame Type Descriptor<===
bLength:                           0x22
bDescriptorType:                   0x24
bDescriptorSubtype:                0x07
bFrameIndex:                       0x07
bmCapabilities:                    0x01
wWidth:                          0x01B0 = 432
wHeight:                         0x00F0 = 240
dwMinBitRate:                0x02398800
dwMaxBitRate:                0x04731000
dwMaxVideoFrameBufferSize:   0x0004BF00
dwDefaultFrameInterval:      0x00051615 = 33.333300 mSec (30.00 Hz)
bFrameIntervalType:                0x02
===>Additional Discrete Frame TypeData
dwFrameInterval[1]:          0x00051615 = 33.333300 mSec (30.00 Hz)
dwFrameInterval[2]:          0x000A2C2A = 66.666600 mSec (15.00 Hz)

          ===>Video Streaming MJPEG Frame Type Descriptor<===
bLength:                           0x22
bDescriptorType:                   0x24
bDescriptorSubtype:                0x07
bFrameIndex:                       0x08
bmCapabilities:                    0x01
wWidth:                          0x0140 = 320
wHeight:                         0x00B0 = 176
dwMinBitRate:                0x01356000
dwMaxBitRate:                0x026AC000
dwMaxVideoFrameBufferSize:   0x00029400
dwDefaultFrameInterval:      0x00051615 = 33.333300 mSec (30.00 Hz)
bFrameIntervalType:                0x02
===>Additional Discrete Frame TypeData
dwFrameInterval[1]:          0x00051615 = 33.333300 mSec (30.00 Hz)
dwFrameInterval[2]:          0x000A2C2A = 66.666600 mSec (15.00 Hz)

          ===>Video Streaming MJPEG Frame Type Descriptor<===
bLength:                           0x22
bDescriptorType:                   0x24
bDescriptorSubtype:                0x07
bFrameIndex:                       0x09
bmCapabilities:                    0x01
wWidth:                          0x0280 = 640
wHeight:                         0x0168 = 360
dwMinBitRate:                0x04F1A000
dwMaxBitRate:                0x09E34000
dwMaxVideoFrameBufferSize:   0x000A8C00
dwDefaultFrameInterval:      0x00051615 = 33.333300 mSec (30.00 Hz)
bFrameIntervalType:                0x02
===>Additional Discrete Frame TypeData
dwFrameInterval[1]:          0x00051615 = 33.333300 mSec (30.00 Hz)
dwFrameInterval[2]:          0x000A2C2A = 66.666600 mSec (15.00 Hz)

          ===>Video Streaming MJPEG Frame Type Descriptor<===
bLength:                           0x22
bDescriptorType:                   0x24
bDescriptorSubtype:                0x07
bFrameIndex:                       0x0A
bmCapabilities:                    0x01
wWidth:                          0x0320 = 800
wHeight:                         0x01E0 = 480
dwMinBitRate:                0x083D6000
dwMaxBitRate:                0x107AC000
dwMaxVideoFrameBufferSize:   0x00119400
dwDefaultFrameInterval:      0x00051615 = 33.333300 mSec (30.00 Hz)
bFrameIntervalType:                0x02
===>Additional Discrete Frame TypeData
dwFrameInterval[1]:          0x00051615 = 33.333300 mSec (30.00 Hz)
dwFrameInterval[2]:          0x000A2C2A = 66.666600 mSec (15.00 Hz)

          ===>Video Streaming MJPEG Frame Type Descriptor<===
bLength:                           0x22
bDescriptorType:                   0x24
bDescriptorSubtype:                0x07
bFrameIndex:                       0x0B
bmCapabilities:                    0x01
wWidth:                          0x0400 = 1024
wHeight:                         0x0300 = 768
dwMinBitRate:                0x10E00000
dwMaxBitRate:                0x21C00000
dwMaxVideoFrameBufferSize:   0x00240000
dwDefaultFrameInterval:      0x00051615 = 33.333300 mSec (30.00 Hz)
bFrameIntervalType:                0x02
===>Additional Discrete Frame TypeData
dwFrameInterval[1]:          0x00051615 = 33.333300 mSec (30.00 Hz)
dwFrameInterval[2]:          0x000A2C2A = 66.666600 mSec (15.00 Hz)

          ===>Color Matching Descriptor<===
bLength:                           0x06
bDescriptorType:                   0x24
bDescriptorSubtype:                0x0D
bColorPrimaries:                   0x01
bTransferCharacteristics:          0x01
bMatrixCoefficients:               0x04

          ===>Interface Descriptor<===
bLength:                           0x09
bDescriptorType:                   0x04
bInterfaceNumber:                  0x01
bAlternateSetting:                 0x01
bNumEndpoints:                     0x01
bInterfaceClass:                   0x0E  -> Video Interface Class
bInterfaceSubClass:                0x02  -> Video Streaming Interface SubClass
bInterfaceProtocol:                0x00
iInterface:                        0x04
     English (United States)  "Webcam C170"

          ===>Endpoint Descriptor<===
bLength:                           0x07
bDescriptorType:                   0x05
bEndpointAddress:                  0x82  -> Direction: IN - EndpointID: 2
bmAttributes:                      0x05  -> Isochronous Transfer Type, Synchronization Type = Asynchronous, Usage Type = Data Endpoint
wMaxPacketSize:                  0x1400 = 3 transactions per microframe, 0x400 max bytes
bInterval:                         0x01

          ===>Interface Descriptor<===
bLength:                           0x09
bDescriptorType:                   0x04
bInterfaceNumber:                  0x01
bAlternateSetting:                 0x02
bNumEndpoints:                     0x01
bInterfaceClass:                   0x0E  -> Video Interface Class
bInterfaceSubClass:                0x02  -> Video Streaming Interface SubClass
bInterfaceProtocol:                0x00
iInterface:                        0x04
     English (United States)  "Webcam C170"

          ===>Endpoint Descriptor<===
bLength:                           0x07
bDescriptorType:                   0x05
bEndpointAddress:                  0x82  -> Direction: IN - EndpointID: 2
bmAttributes:                      0x05  -> Isochronous Transfer Type, Synchronization Type = Asynchronous, Usage Type = Data Endpoint
wMaxPacketSize:                  0x0C00 = 2 transactions per microframe, 0x400 max bytes
bInterval:                         0x01

          ===>Interface Descriptor<===
bLength:                           0x09
bDescriptorType:                   0x04
bInterfaceNumber:                  0x01
bAlternateSetting:                 0x03
bNumEndpoints:                     0x01
bInterfaceClass:                   0x0E  -> Video Interface Class
bInterfaceSubClass:                0x02  -> Video Streaming Interface SubClass
bInterfaceProtocol:                0x00
iInterface:                        0x04
     English (United States)  "Webcam C170"

          ===>Endpoint Descriptor<===
bLength:                           0x07
bDescriptorType:                   0x05
bEndpointAddress:                  0x82  -> Direction: IN - EndpointID: 2
bmAttributes:                      0x05  -> Isochronous Transfer Type, Synchronization Type = Asynchronous, Usage Type = Data Endpoint
wMaxPacketSize:                  0x0400 = 1 transactions per microframe, 0x400 max bytes
bInterval:                         0x01

          ===>Interface Descriptor<===
bLength:                           0x09
bDescriptorType:                   0x04
bInterfaceNumber:                  0x01
bAlternateSetting:                 0x04
bNumEndpoints:                     0x01
bInterfaceClass:                   0x0E  -> Video Interface Class
bInterfaceSubClass:                0x02  -> Video Streaming Interface SubClass
bInterfaceProtocol:                0x00
iInterface:                        0x04
     English (United States)  "Webcam C170"

          ===>Endpoint Descriptor<===
bLength:                           0x07
bDescriptorType:                   0x05
bEndpointAddress:                  0x82  -> Direction: IN - EndpointID: 2
bmAttributes:                      0x05  -> Isochronous Transfer Type, Synchronization Type = Asynchronous, Usage Type = Data Endpoint
wMaxPacketSize:                  0x0200 = 1 transactions per microframe, 0x200 max bytes
bInterval:                         0x01

          ===>IAD Descriptor<===
bLength:                           0x08
bDescriptorType:                   0x0B
bFirstInterface:                   0x02
bInterfaceCount:                   0x02
bFunctionClass:                    0x01  -> Audio Interface Class
bFunctionSubClass:                 0x00
*!*CAUTION:    This appears to be an invalid bFunctionSubClass
bFunctionProtocol:                 0x00
iFunction:                         0x05
     English (United States)  "Webcam C170"

          ===>Interface Descriptor<===
bLength:                           0x09
bDescriptorType:                   0x04
bInterfaceNumber:                  0x02
bAlternateSetting:                 0x00
bNumEndpoints:                     0x00
bInterfaceClass:                   0x01  -> Audio Interface Class
bInterfaceSubClass:                0x01  -> Audio Control Interface SubClass
bInterfaceProtocol:                0x00
iInterface:                        0x05
     English (United States)  "Webcam C170"

          ===>Audio Control Interface Header Descriptor<===
bLength:                           0x09
bDescriptorType:                   0x24 (CS_INTERFACE)
bDescriptorSubtype:                0x01 (HEADER)
bcdADC:                          0x0100
wTotalLength:                    0x002B
bInCollection:                     0x01
baInterfaceNr[1]:                  0x03

          ===>Audio Control Input Terminal Descriptor<===
bLength:                           0x0C
bDescriptorType:                   0x24 (CS_INTERFACE)
bDescriptorSubtype:                0x02 (INPUT_TERMINAL)
bTerminalID:                       0x01
wTerminalType:                   0x0201 (Microphone)
bAssocTerminal:                    0x00
bNrChannels:                       0x01
wChannelConfig:                  0x0000
iChannelNames:                     0x00
iTerminal:                         0x00

          ===>Audio Control Feature Unit Descriptor<===
bLength:                           0x0D
bDescriptorType:                   0x24 (CS_INTERFACE)
bDescriptorSubtype:                0x06 (FEATURE_UNIT)
bUnitID:                           0x05
bSourceID:                         0x01
bControlSize:                      0x06
bmaControls[master]:               03 00 00 00 00 00 
iFeature:                          0x00

          ===>Audio Control Output Terminal Descriptor<===
bLength:                           0x09
bDescriptorType:                   0x24 (CS_INTERFACE)
bDescriptorSubtype:                0x03 (OUTPUT_TERMINAL)
bTerminalID:                       0x03
wTerminalType:                   0x0101 (USB streaming)
bAssocTerminal:                    0x00
bSourceID:                         0x05
iTerminal:                         0x00

          ===>Interface Descriptor<===
bLength:                           0x09
bDescriptorType:                   0x04
bInterfaceNumber:                  0x03
bAlternateSetting:                 0x00
bNumEndpoints:                     0x00
bInterfaceClass:                   0x01  -> Audio Interface Class
bInterfaceSubClass:                0x02  -> Audio Streaming Interface SubClass
bInterfaceProtocol:                0x00
iInterface:                        0x05
     English (United States)  "Webcam C170"

          ===>Interface Descriptor<===
bLength:                           0x09
bDescriptorType:                   0x04
bInterfaceNumber:                  0x03
bAlternateSetting:                 0x01
bNumEndpoints:                     0x01
bInterfaceClass:                   0x01  -> Audio Interface Class
bInterfaceSubClass:                0x02  -> Audio Streaming Interface SubClass
bInterfaceProtocol:                0x00
iInterface:                        0x05
     English (United States)  "Webcam C170"

          ===>Audio Streaming Class Specific Interface Descriptor<===
bLength:                           0x07
bDescriptorType:                   0x24 (CS_INTERFACE)
bDescriptorSubtype:                0x01 (AS_GENERAL)
bTerminalLink:                     0x03
bDelay:                            0x01
wFormatTag:                      0x0001 (PCM)

          ===>Audio Streaming Format Type Descriptor<===
bLength:                           0x20
bDescriptorType:                   0x24 (CS_INTERFACE)
bDescriptorSubtype:                0x02 (FORMAT_TYPE)
bFormatType:                       0x01 (FORMAT_TYPE_I)
bNrChannels:                       0x01
bSubframeSize:                     0x02
bBitResolution:                    0x10 (16)
bSamFreqType:                      0x08 (Discrete)
tSamFreq[1]:                   0x00BB80 (48000 Hz)
tSamFreq[2]:                   0x00AC44 (44100 Hz)
tSamFreq[3]:                   0x005DC0 (24000 Hz)
tSamFreq[4]:                   0x005622 (22050 Hz)
tSamFreq[5]:                   0x003E80 (16000 Hz)
tSamFreq[6]:                   0x002EE0 (12000 Hz)
tSamFreq[7]:                   0x002B11 (11025 Hz)
tSamFreq[8]:                   0x001F40 (8000 Hz)

          ===>Endpoint Descriptor<===
bLength:                           0x09
bDescriptorType:                   0x05
bEndpointAddress:                  0x83  -> Direction: IN - EndpointID: 3
bmAttributes:                      0x0D  -> Isochronous Transfer Type, Synchronization Type = Synchronous, Usage Type = Data Endpoint
wMaxPacketSize:                  0x0064 = 1 transactions per microframe, 0x64 max bytes
wInterval:                       0x0004
bSyncAddress:                      0x00

          ===>Audio Streaming Class Specific Audio Data Endpoint Descriptor<===
bLength:                           0x07
bDescriptorType:                   0x25 (CS_ENDPOINT)
bDescriptorSubtype:                0x01 (EP_GENERAL)
bmAttributes:                      0x01
                                   (Sampling Frequency control)
bLockDelayUnits:                   0x01 (Milliseconds)
wLockDelay:                      0x0000

          ===>Interface Descriptor<===
bLength:                           0x09
bDescriptorType:                   0x04
bInterfaceNumber:                  0x03
bAlternateSetting:                 0x02
bNumEndpoints:                     0x01
bInterfaceClass:                   0x01  -> Audio Interface Class
bInterfaceSubClass:                0x02  -> Audio Streaming Interface SubClass
bInterfaceProtocol:                0x00
iInterface:                        0x05
     English (United States)  "Webcam C170"

          ===>Audio Streaming Class Specific Interface Descriptor<===
bLength:                           0x07
bDescriptorType:                   0x24 (CS_INTERFACE)
bDescriptorSubtype:                0x01 (AS_GENERAL)
bTerminalLink:                     0x03
bDelay:                            0x01
wFormatTag:                      0x0001 (PCM)

          ===>Audio Streaming Format Type Descriptor<===
bLength:                           0x20
bDescriptorType:                   0x24 (CS_INTERFACE)
bDescriptorSubtype:                0x02 (FORMAT_TYPE)
bFormatType:                       0x01 (FORMAT_TYPE_I)
bNrChannels:                       0x01
bSubframeSize:                     0x01
bBitResolution:                    0x08 (8)
bSamFreqType:                      0x08 (Discrete)
tSamFreq[1]:                   0x00BB80 (48000 Hz)
tSamFreq[2]:                   0x00AC44 (44100 Hz)
tSamFreq[3]:                   0x005DC0 (24000 Hz)
tSamFreq[4]:                   0x005622 (22050 Hz)
tSamFreq[5]:                   0x003E80 (16000 Hz)
tSamFreq[6]:                   0x002EE0 (12000 Hz)
tSamFreq[7]:                   0x002B11 (11025 Hz)
tSamFreq[8]:                   0x001F40 (8000 Hz)

          ===>Endpoint Descriptor<===
bLength:                           0x09
bDescriptorType:                   0x05
bEndpointAddress:                  0x83  -> Direction: IN - EndpointID: 3
bmAttributes:                      0x0D  -> Isochronous Transfer Type, Synchronization Type = Synchronous, Usage Type = Data Endpoint
wMaxPacketSize:                  0x0032 = 1 transactions per microframe, 0x32 max bytes
wInterval:                       0x0004
bSyncAddress:                      0x00

          ===>Audio Streaming Class Specific Audio Data Endpoint Descriptor<===
bLength:                           0x07
bDescriptorType:                   0x25 (CS_ENDPOINT)
bDescriptorSubtype:                0x01 (EP_GENERAL)
bmAttributes:                      0x01
                                   (Sampling Frequency control)
bLockDelayUnits:                   0x01 (Milliseconds)
wLockDelay:                      0x0000

          ===>Additional Error Checking<===
PASS: number of uncompressed-frame frame descriptors (9) == number of frame descriptors (9) specified in uncompressed format descriptor(s)
PASS: number of MJPEG frame descriptors (11) == number of frame descriptors (11) specified in MJPEG format descriptor(s)
